{
  "schema_version": "1.0.0",
  "title": "Салат из огурцов и томатов",
  "servings": 2,
  "ingredients": [
    {
      "name": "Огурцы",
      "quantity": {
        "value": 200,
        "unit": "g"
      }
    },
    {
      "name": "Томаты",
      "quantity": {
        "value": 200,
        "unit": "g"
      }
    },
    {
      "name": "Растительное масло",
      "quantity": {
        "value": 1,
        "unit": "tbsp"
      }
    }
  ],
  "steps": [
    {
      "instruction": "Нарезать огурцы и томаты."
    },
    {
      "instruction": "Добавить масло и перемешать."
    }
  ],
  "source": {
    "type": "url",
    "url": "https://example.org/videos/salad"
  },
  "total_time_minutes": null
}
