{
  "schema_version": "1.0.0",
  "title": "Омлет",
  "servings": 1,
  "ingredients": [
    {
      "name": "Яйца",
      "quantity": {
        "value": 2,
        "unit": "pcs"
      }
    },
    {
      "name": "Молоко",
      "quantity": {
        "value": 30,
        "unit": "ml"
      }
    }
  ],
  "steps": [
    {
      "instruction": "Взбить яйца с молоком."
    },
    {
      "instruction": "Вылить на сковороду и готовить до схватывания."
    }
  ],
  "source": {
    "type": "url",
    "url": "https://example.org/videos/omelette"
  },
  "total_time_minutes": null
}
